{
  "schema_version": 2,
  "plan_id": "portfolio_20260716_001",
  "risk_decision_id": "risk_portfolio_20260716_001",
  "risk_unit_id": "account:acc_1001:settlement:USDT",
  "decision_sequence": 201,
  "action": "LIQUIDATE_PORTFOLIO",
  "execution_priority": 5,
  "user_id": 1001,
  "account_id": "acc_1001",
  "account_version": 88,
  "margin_mode": "CROSS",
  "max_total_authorized_notional": "100000",
  "failure_mode": "STOP_ON_FAILURE",
  "items": [
    {
      "action": "LIQUIDATE_POSITION",
      "position_id": 888,
      "position_version": 42,
      "symbol": "BTCUSDT",
      "position_side": "LONG",
      "authorized_notional": "60000",
      "instruction": {
        "target_quantity": "0.01",
        "max_executable_quantity": "0.01",
        "quantity_mode": "EXACT",
        "order_type": "MARKET",
        "reduce_only": true,
        "time_in_force": "IOC",
        "max_slippage": "0.005"
      },
      "price_protection": {
        "bankruptcy_price": "54000",
        "max_deviation": "0.03",
        "quote_max_age_ms": 2000
      },
      "risk_snapshot": {
        "position_size": "0.01",
        "mark_price": "54200",
        "market_data_timestamp": "2026-07-16T02:00:00Z"
      }
    }
  ],
  "expire_at": "2026-07-16T02:05:00Z",
  "created_at": "2026-07-16T02:00:00Z"
}
